{"authority":"advisory","flow_digest":"sha256:bc0ac27045a1d1930583addd866e3bffb348a691b139eca51837f02812b78a09","state_digest":"sha256:0e9ec8f38e5cdd354b71f965fbd5be3e075420481865248d789ed7d1d32f7308","states":[{"count":13,"id":"conformance"},{"count":53,"id":"core"}],"transition_digest":"sha256:4fb25b794a067528dea8dd343310434d81c6a3ce1257799c93749d20e363db18","transitions":[{"count":107,"evidence_edges":["e:calls:PublicApiTests.test_core_replay:ak.replay:13:10","e:calls:PublicApiTests.test_core_replay:self.assertEqual:14:4","e:calls:PublicApiTests.test_core_replay:self.assertEqual:15:4","e:calls:PublicApiTests.test_core_replay:self.assertEqual:16:4","e:calls:PublicApiTests.test_identity_surface:self.assertEqual:22:4","e:calls:PublicApiTests.test_identity_surface:self.assertTrue:20:4"],"from":"conformance","kind":"Calls","to":"conformance"},{"count":12,"evidence_edges":["e:imports:unittest","e:imports:unittest","e:imports:unittest","e:imports:unittest","e:imports:unittest","e:imports:unittest"],"from":"conformance","kind":"Imports","to":"conformance"},{"count":5,"evidence_edges":["e:calls:AsgTests.test_ingest_deterministic:validate_asg_frame:14:4","e:calls:AsgTests.test_mjs_ingest_deterministic:validate_asg_frame:56:4","e:calls:AsgTests.test_typescript_ingest_deterministic:validate_asg_frame:28:4","e:calls:AsgTests.test_typescript_syntax_ignores_comment_and_string_tokens:validate_asg_frame:43:4","e:calls:AsgTests.test_validate_fails_on_bad_hash:validate_asg_frame:21:6"],"from":"conformance","kind":"Calls","to":"control"},{"count":180,"evidence_edges":["e:calls:PublicApiTests.test_core_replay:ak.delta:16:29","e:calls:PublicApiTests.test_core_replay:len:14:21","e:calls:PublicApiTests.test_identity_surface:ak.advance_clock:21:9","e:calls:PublicApiTests.test_identity_surface:ak.compute_oid:23:10","e:calls:PublicApiTests.test_identity_surface:ak.compute_typed_sid:19:10","e:calls:PublicApiTests.test_identity_surface:oid.startswith:24:20"],"from":"conformance","kind":"Calls","to":"core"},{"count":17,"evidence_edges":["e:imports:atomic_kernel","e:imports:json","e:imports:pathlib","e:imports:json","e:imports:pathlib","e:imports:pathlib"],"from":"conformance","kind":"Imports","to":"core"},{"count":1,"evidence_edges":["e:calls:SeedCompanionTests.test_projection_metadata_helper:to_projection_metadata:58:11"],"from":"conformance","kind":"Calls","to":"projection"},{"count":19,"evidence_edges":["e:calls:Lane16Tests.test_accept_corpus:Lane16System.init:37:17","e:calls:Lane16Tests.test_must_reject_corpus:Lane16Error:61:18","e:calls:Lane16Tests.test_must_reject_corpus:Lane16Error:69:18","e:calls:Lane16Tests.test_must_reject_corpus:Lane16Error:71:16","e:calls:Lane16Tests.test_must_reject_corpus:Lane16System.init:65:19","e:calls:SeedAlgebraTests.test_accept_corpus:validate_seed_entity:47:8"],"from":"conformance","kind":"Calls","to":"runtime"},{"count":13,"evidence_edges":["e:imports:runtime.atomic_kernel.asg","e:imports:runtime.atomic_kernel.identity","e:imports:runtime.atomic_kernel.lane16","e:imports:runtime.atomic_kernel.living_xml","e:imports:runtime.atomic_kernel.tools.living_xml_fuzz","e:imports:runtime.atomic_kernel.asg"],"from":"conformance","kind":"Imports","to":"runtime"},{"count":6,"evidence_edges":["e:calls:ingest_typescript_to_asg:_check_ts_syntax:407:2","e:calls:get_identity_object:AssertionError:148:8","e:calls:Lane16System.sync_group:fano_pcg_check:183:11","e:calls:_extract_code:AssertionError:37:8","e:calls:_extract_tick_bounds:AssertionError:64:8","e:calls:main:_check_ts_syntax:60:6"],"from":"core","kind":"Calls","to":"conformance"},{"count":23,"evidence_edges":["e:calls:ingest_mjs_to_asg:_hash_frame_without_hash:658:24","e:calls:ingest_python_to_asg:_hash_frame_without_hash:225:24","e:calls:ingest_typescript_to_asg:_hash_frame_without_hash:497:24","e:calls:validate_asg_frame:_hash_frame_without_hash:724:13","e:calls:validate_asg_frame:frame.keys:665:13","e:calls:encode_lane_state:control_code:101:17"],"from":"core","kind":"Calls","to":"control"},{"count":2,"evidence_edges":["e:imports:frame","e:imports:frame"],"from":"core","kind":"Imports","to":"control"},{"count":3028,"evidence_edges":["e:calls:_normalize:_mask:18:13","e:calls:_repeat_1d_constant:range:35:11","e:calls:_require_width:ValueError:10:10","e:calls:_rotl:_normalize:22:6","e:calls:_rotl:_normalize:24:9","e:calls:_rotr:_normalize:28:6"],"from":"core","kind":"Calls","to":"core"},{"count":217,"evidence_edges":["e:imports:core","e:imports:__future__","e:imports:typing","e:imports:__future__","e:imports:typing","e:imports:hashlib"],"from":"core","kind":"Imports","to":"core"},{"count":40,"evidence_edges":["e:calls:main:derive_genesis_seed:24:11","e:calls:FanoScheduler.add_process:FanoSchedulerError:74:12","e:calls:_require_line:FanoSchedulerError:27:10","e:calls:_require_point:FanoSchedulerError:32:10","e:calls:next_on_line:FanoSchedulerError:40:10","e:calls:_fail:SemanticIdentityError:20:8"],"from":"core","kind":"Calls","to":"runtime"},{"count":30,"evidence_edges":["e:imports:identity","e:imports:seed","e:imports:runtime.atomic_kernel.identity","e:imports:runtime.atomic_kernel.lane16","e:imports:runtime.atomic_kernel.seed_algebra","e:imports:lane16"],"from":"core","kind":"Imports","to":"runtime"}],"v":"protocol-flow.v0"}
