{"authority":"advisory","flow_digest":"sha256:73deb1ffc4a162542ef0ef83596762e3a1476cddcff4f69791c3518997123ce7","state_digest":"sha256:0eb3c7ce2676318bf65a20e86a1a404393bfaf4fad9d9ca146a14fa5400b2cc8","states":[{"count":22,"id":"conformance"},{"count":1,"id":"control"},{"count":84,"id":"core"}],"transition_digest":"sha256:d05a4ec17b946b1cae67c7e0f399c43b1676d6b840ef67249ba9efa7886d9106","transitions":[{"count":217,"evidence_edges":["e:calls:PublicApiTests.test_core_replay:ak.replay:13:10","e:calls:PublicApiTests.test_core_replay:self.assertEqual:14:4","e:calls:PublicApiTests.test_core_replay:self.assertEqual:15:4","e:calls:PublicApiTests.test_core_replay:self.assertEqual:16:4","e:calls:PublicApiTests.test_identity_surface:self.assertEqual:22:4","e:calls:PublicApiTests.test_identity_surface:self.assertTrue:20:4"],"from":"conformance","kind":"Calls","to":"conformance"},{"count":17,"evidence_edges":["e:imports:unittest","e:imports:replay_engine","e:imports:replay_engine","e:imports:replay_engine","e:imports:unittest","e:imports:unittest"],"from":"conformance","kind":"Imports","to":"conformance"},{"count":14,"evidence_edges":["e:calls:V1Tests.test_control_plane_fail_closed:validate_control_plane:91:14","e:calls:V1Tests.test_control_plane_ordering:validate_control_plane:96:14","e:calls:V1Tests.test_reserved_control_code_rejected:frame_value:88:12","e:calls:V1Tests.test_sign_value_roundtrip:frame_value:69:14","e:calls:V1Tests.test_sign_value_roundtrip:frame_value:69:41","e:calls:V1Tests.test_sign_value_roundtrip:frame_value:69:62"],"from":"conformance","kind":"Calls","to":"control"},{"count":1,"evidence_edges":["e:imports:control_plane"],"from":"conformance","kind":"Imports","to":"control"},{"count":473,"evidence_edges":["e:calls:PublicApiTests.test_core_replay:ak.delta:16:29","e:calls:PublicApiTests.test_core_replay:len:14:21","e:calls:PublicApiTests.test_identity_surface:ak.advance_clock:21:9","e:calls:PublicApiTests.test_identity_surface:ak.compute_oid:23:10","e:calls:PublicApiTests.test_identity_surface:ak.compute_typed_sid:19:10","e:calls:PublicApiTests.test_identity_surface:oid.startswith:24:20"],"from":"conformance","kind":"Calls","to":"core"},{"count":63,"evidence_edges":["e:imports:atomic_kernel","e:imports:__future__","e:imports:canonical","e:imports:json","e:imports:pathlib","e:imports:subprocess"],"from":"conformance","kind":"Imports","to":"core"},{"count":3,"evidence_edges":["e:calls:replay_artifact:_state_4bit_projection:211:32","e:calls:replay_artifact:_state_4bit_projection:226:32","e:calls:SeedCompanionTests.test_projection_metadata_helper:to_projection_metadata:58:11"],"from":"conformance","kind":"Calls","to":"projection"},{"count":19,"evidence_edges":["e:calls:Lane16Tests.test_accept_corpus:Lane16System.init:37:17","e:calls:Lane16Tests.test_must_reject_corpus:Lane16Error:61:18","e:calls:Lane16Tests.test_must_reject_corpus:Lane16Error:69:18","e:calls:Lane16Tests.test_must_reject_corpus:Lane16Error:71:16","e:calls:Lane16Tests.test_must_reject_corpus:Lane16System.init:65:19","e:calls:SeedAlgebraTests.test_accept_corpus:validate_seed_entity:47:8"],"from":"conformance","kind":"Calls","to":"runtime"},{"count":15,"evidence_edges":["e:imports:identity","e:imports:runtime.atomic_kernel.asg","e:imports:runtime.atomic_kernel.identity","e:imports:runtime.atomic_kernel.lane16","e:imports:runtime.atomic_kernel.living_xml","e:imports:runtime.atomic_kernel.tools.living_xml_fuzz"],"from":"conformance","kind":"Imports","to":"runtime"},{"count":2,"evidence_edges":["e:calls:parse_control_plane:_contains_disallowed_controls:49:7","e:calls:validate_control_plane:parse_control_plane:101:20"],"from":"control","kind":"Calls","to":"control"},{"count":25,"evidence_edges":["e:calls:_contains_disallowed_controls:ord:39:11","e:calls:_contains_disallowed_controls:ord:39:83","e:calls:parse_control_plane:any:65:7","e:calls:parse_control_plane:any:71:11","e:calls:parse_control_plane:any:77:15","e:calls:parse_control_plane:any:83:19"],"from":"control","kind":"Calls","to":"core"},{"count":4,"evidence_edges":["e:imports:canonical","e:imports:dataclasses","e:imports:stream_sign_value","e:imports:typing"],"from":"control","kind":"Imports","to":"core"},{"count":31,"evidence_edges":["e:calls:AtomicKernelHandler.do_POST:check_parity:270:22","e:calls:AtomicKernelHandler.do_POST:replay_artifact:174:23","e:calls:AtomicKernelHandler.do_POST:replay_artifact:188:23","e:calls:_identity_verify:chain.verify:92:19","e:calls:canonicalize:replay_artifact:27:13","e:calls:cmd_pack_proof:replay_artifact:396:16"],"from":"core","kind":"Calls","to":"conformance"},{"count":6,"evidence_edges":["e:imports:replay_engine","e:imports:replay","e:imports:replay_engine","e:imports:replay_engine","e:imports:replay_engine","e:imports:replay_engine"],"from":"core","kind":"Imports","to":"conformance"},{"count":37,"evidence_edges":["e:calls:AtomicKernelHandler.do_POST:validate_control_plane:212:21","e:calls:canonicalize:encode_to_control_stream:21:13","e:calls:canonicalize_stream:frame_bel_counts.append:237:12","e:calls:canonicalize_stream:frame_bel_counts.append:245:16","e:calls:canonicalize_stream:frame_totals.append:236:12","e:calls:canonicalize_stream:frame_totals.append:244:16"],"from":"core","kind":"Calls","to":"control"},{"count":3,"evidence_edges":["e:imports:control_plane","e:imports:frame","e:imports:frame"],"from":"core","kind":"Imports","to":"control"},{"count":4045,"evidence_edges":["e:calls:_normalize:_mask:18:13","e:calls:_repeat_1d_constant:range:35:11","e:calls:_require_width:ValueError:10:10","e:calls:_rotl:_normalize:22:6","e:calls:_rotl:_normalize:24:9","e:calls:_rotr:_normalize:28:6"],"from":"core","kind":"Calls","to":"core"},{"count":343,"evidence_edges":["e:imports:core","e:imports:__future__","e:imports:typing","e:imports:__future__","e:imports:typing","e:imports:warnings"],"from":"core","kind":"Imports","to":"core"},{"count":72,"evidence_edges":["e:calls:main:derive_genesis_seed:24:11","e:calls:AtomicKernelHandler.do_POST:_identity_verify:240:21","e:calls:AtomicKernelHandler.do_POST:_seed_int:169:23","e:calls:AtomicKernelHandler.do_POST:_seed_int:183:23","e:calls:AtomicKernelHandler.do_POST:_seed_int:235:23","e:calls:_cp_to_digits:divmod:17:15"],"from":"core","kind":"Calls","to":"runtime"},{"count":39,"evidence_edges":["e:imports:identity","e:imports:seed","e:imports:runtime.atomic_kernel.identity","e:imports:runtime.atomic_kernel.vnext","e:imports:runtime.atomic_kernel.lane16","e:imports:runtime.atomic_kernel.seed_algebra"],"from":"core","kind":"Imports","to":"runtime"}],"v":"protocol-flow.v0"}
